text,label
"Given that a = -10, b = 2, c = 5 and d = 0. Evaluate the following relational and logical expressions:",Application
How can you categorize ____ according to...?,Analysis
 Sketch a prediction of the field lines for the arrangement of electrodes shown in Figure 2,Application
Propose an alternative way to solve …  ,Synthesis
"Divide the story into initiating event, rising action, climax, and falling action",Analysis
List the fractions you know and can show….,Knowledge
List reserved words in C programming.,Knowledge
Explain three (3) lean techniques that work in both the manufacturing and service sector. ,Comprehension
Name the four different types of interactions involved in building the tertiary structure of proteins and give one denaturing agent for each.,Comprehension
Define knowledge and provide an example of knowledge produced by a vehicle management system.,Knowledge
Can you solve the following problem ,Application
"If interest were compounded monthly instead of daily, what would the difference in interest be?",Analysis
Create a poster that promote jeans to local senior citizen which appeal directly to a multiracial citizen in Malaysia.,Synthesis
Explain  THREE  (3)  benefits   of  JDBC  pooling  m  the  context  of  database connection.,Comprehension
"Differentiate bonds that are traded at par, premium and discount.",Analysis
Justify the object oriented programming concept,Evaluation
Cloud computing evolved from earlier technologies. State them.,Knowledge
State the significance of “Score” in the BlastX alignment. ,Comprehension
There are a number of factors influencing the productivity of a sector of the economy. Explain accordingly. ,Comprehension
Malaysia is currently having trade deficit and policy maker tries to improve the balance of trade by depreciate the Ringgit Malaysia. Discuss the impact of this policy by using an appropriate diagram. ,Comprehension
"Explain the concept of price leadership observed under the condition of oligopoly, by using graphs. ",Comprehension
Select a local 'HOMEGROWN' brand and discuss its international marketing mix.,Comprehension
Draw the flow chart of the PNK system,Knowledge
Give TWO functions of egg yolks in mayonnaise production. ,Comprehension
Eukaryotic genome is mostly repetitive DNA and non-coding sequences. Elaborate the statement. ,Comprehension
Elaborate the objectives and basic design procedure of the foundation design of a building. ,Comprehension
State what does the symbol “+” represents. ,Knowledge
Describe the Pareto Principle in statistical software quality assurance.,Comprehension
Discuss TWO (2) web application frameworks that are suitable to be used in the proposed application.,Synthesis
“Domestication of animals does not influence human behavior and lifestyle.” State whether you agree or disagree with the statement. Justify your answer. ,Evaluation
Draw the hexapeptide Gly-Phe-Asp-Leu-Ala-Glu. Identify the formation of hydrogen bonding in an a-helix form of this hexapeptide.,Comprehension
Relate your most powerful story where your use of technology in the classroom has yielded a significant outcome with a student or students,Application
Explain THREE (3) advantages of MVC (Model View Controller) pattern in developing  web  applications.,Comprehension
Briefly explain THREE (3) main sources of banks earnings.,Comprehension
Explain why it is likely that a matriarchal family system would be found in a matrilocal or matrilineal society.,Synthesis
Evaluate whether their model is a true representation of the local environment.,Evaluation
How to combine virtual symmetry and symbolic model checking effectively,Synthesis
Explain the case study research method and distinguish between single and multiple case study design.,Analysis
Explain how competitive and uncompetitive inhibitors will affect enzymatic reactions. ,Comprehension
"Write an appropriate learning outcome to teach “in”, “on”, beside', 'opposite and 'under. ",Comprehension
Explain on multimedia delivering on World Wide Web.,Comprehension
Sleep is a local phenomenon. Explain how this is possible. Provide TWO (2) examples to illustrate this. ,Comprehension
"Related party transaction is a transaction entered into by a PLC or its subsidiaries, which involved the interest of the related party. Justify the reasons for disclosure of related party transaction. ",Evaluation
"Calculate the total cost per year, including the cost of the lights. ",Application
Briefly explain the main feature of the structures of dilute foams and concentrated foams. ,Comprehension
Describe in prose what is shown in graph form.,Comprehension
Summarize the main point of these two texts in your own words ,Comprehension
Draw a color wheel diagram with primary and secondary color. ,Comprehension
Explain how auction is related to dynamic pricing.,Comprehension
"Your profit from previous project is RM30,000.00 and you just won a new project to construct a new airport runway at Sepang, Selangor. Decide whether you are going to purchase the bulldozer or pay out bonuses to your staff. Use the concept of opportunities cost, choices and scarcity to aid your explanation. ",Application
"Recommend with justification, a value or range of values to the Board of Directors for the acquisition of ESL Berhad.",Evaluation
"List any FIVE (5) themes identified by Tom Peters and Robert Waterman for “excellent 
organizations"". ",Knowledge
Suggest and describe an assisted reproductive technique that the farm should use for rapid and cost effective production. ,Synthesis
"Discuss  how  data  mining  operations  which  are  classification,  association, clustering and anomaly detection can be deployed in a variety of industries.",Application
Illustrate the stages of product approach of teaching ESL writing. Use appropriate examples. ,Comprehension
List the major forces acting on the concrete body of the dam excluding earthquake and wind forces. ,Comprehension
Why don’t you devise your own way to deal with . . .?,Synthesis
Draw and label the model of Karl Weick's Theory of Organizing. ,Comprehension
How would you have handled . . .?,Evaluation
Determine if the two principal components are adequate to explain the variation in the sample that was used to calculate I.,Application
Describe the economic growth and FOUR (4) sources of economic growth. ,Knowledge
Design the architecture of the software system based on the requirements defined in the Software Requirement Specification document,Synthesis
Break down the main actions of the story.,Analysis
"Draw the band diagram of a reverse biased pn junction. With reference to the band diagram and charge carriers, explain why there is negligible current flow in the diode. ",Comprehension
Identify TWO (2) strategies that are able to reduce the likelihood of an eyewitness reporting someone who did not commit the crime. ,Analysis
Identify FIVE (5) problem solving processes. ,Knowledge
Provide THREE (3) examples of input devices.,Knowledge
Do you devise a systematic approach in order to get larger progressions,Synthesis
List any SEVEN (7) suggestions for good presentation of your business plan as it is very crucial to convince potential consumers and financers.,Knowledge
Suggest FOUR (4) recommendations in dealing with intersexes. ,Synthesis
Calculate the equilibrium level of income for Cambodia. ,Application
"Draw Production Possibilities Frontier and Trading Possibilities Frontier for Argentina and Mexico.
",Comprehension
What are the structure or functions of Congress,Knowledge
Identify and explain FIVE (5) countries that ban advertising to children. ,Comprehension
Define brainstorming process. ,Knowledge
How was this similar to . . .?,Analysis
Discuss any TWO (2) application areas where multimedia can be used in education environment.,Application
Describe and sketch the THREE (3) types of brick bonding. ,Application
Contrast TWO (2) differences between a data mart and a data warehouse.,Analysis
Name two super secondary structures found within enzymes which involved formation of a-helices. Describe how the a-helices could be maintained in an enzyme. ,Comprehension
Explain why the electrical conductivity of a semiconductor is higher than an insulator by using the energy band diagram. ,Comprehension
"Discriminate the different parts of the story (introduction, development, climax, resolution.)",Analysis
Describe the assumptions of monopolistic competitive market.,Comprehension
Compare Zener breakdown with avalanche breakdown in a pn junction and state THREE differences. Name a device that utilizes each breakdown mode. ,Analysis
Prepare a list of criteria to judge ... Evaluate expressions,Evaluation
Select the best proposal for a proposed water treatment plant.,Evaluation
Formulate the profit for the company. ,Synthesis
Suggest TWO possible poultry breeds that Kaseem are breeding for Malaysia broiler industry. ,Synthesis
Describe the major functions or roles of soil microbes that beneficially impact human health and welfare. ,Comprehension
Chymotrypsin belongs to serine protease family. Describe the catalytic mechanism of chymotrypsin emphasizing the role of the catalytic triad and substrate binding site in catalysis. ,Comprehension
"how do the clauses and expressions given in the article which replace GOTO statements, lead to the three traditional control statements",Synthesis
Summarize a story in own words.,Comprehension
Demonstrate using the OPAC and your knowledge of library organization to find a book about turtles.,Application
"Skimming and scanning are useful ways to familiarise learners with the reading text. 
Evaluate the role of skimming and scanning in the teaching of reading.",Evaluation
What would happen if the rainfall doubled in your state next year,Application
Explain how human capital can lead to economic growth. ,Comprehension
Suppose the two countries wish to specialize and trade. Specifically determine and explain which country enjoys comparative advantage in the production of jade and diamond. ,Application
What questions would you ask if . . .?,Application
"Using transmission-gates, design and sketch a 4-to-1 multiplexer. ",Synthesis
Judge the value of... What do you think about...?,Evaluation
Identify TWO (2) perspectives that are able to explain the origin of prejudice. ,Knowledge
Determine the percentage of variation in the correlation matrix that is explained by the 4 factors.,Application
List down FIVE (5) types of concrete admixture. ,Knowledge
Analyze FOUR (4) advantages of mobile assisted learning as an emerging digital technology used in teaching and learning. ,Analysis
State any FOUR (4) characteristics of valuable information.,Knowledge
Rewrite the story from an animal’s point of view.,Synthesis
Name the keyword in an ABAP program that can be used to invoke the debugging mode.,Knowledge
“Technology has aided manufacturing and service companies in inventory management.' Justify the statement. ,Evaluation
Choose ONE (1) of the factors that you mentioned in question 2(a) and briefly explain why you consider this factor is important. ,Comprehension
Steel is the most widely used reinforcing materials in concrete structure. Briefly explain the general properties of steel. ,Comprehension
How do psychologists differ in their general attitudes toward third party presence,Analysis
Suggest how multimedia applications may  be used for each of the scenarios below. (i) IT Avenue will be organising a road show at various shopping malls to promote a new model of mobile phone from Nokia.,Application
Critically discuss the THREE (3) options in handling the international media planning or buying.,Analysis
"Critique the other student's (or your own) speech, based on the criteria we have studied this semester.",Evaluation
Draw a diagram of the Intelligent System structure with detailed explanation.,Comprehension
"improved, reformed or rejected?",Evaluation
Draw the diagrams for a centralized database and a distributed database.,Comprehension
Explain THREE (3) categories of treatment to enhance the durability of timber. ,Comprehension
"Explain how currency depreciation will affect export, import and the balance of trade of the country. ",Analysis
"Following the identification of the forms of corrosion that were involved in a failure, recommend a solution to avoid this failure?",Synthesis
Distinguish between 'periodic inspection' and 'continuous inspection'. ,Analysis
Explain Greimas square tool and discuss how it can be applied the aviation industry.,Application
Show how NLP techniques can be deployed in business.,Application
Define electronic commerce.,Knowledge
Calculate the optimal size of the production run. ,Application
Define instructional materials based on your understanding. ,Knowledge
Describe the function of International Monetary Fund (IMF).,Knowledge
Justify which digital video file format you would use for your movie.,Evaluation
State which market structure adopts this practice. List and briefly explain what are the conditions needed for this practice to be successful.,Comprehension
Argue the case for conducting experimental research involving humans and propose guidelines to ensure that the dignity and welfare of the subjects are maintained.,Evaluation
"Differentiate between phenylpropanoids and alkaloids in terms of structure, functions and applications. ",Analysis
List three predominant economic systems that exist,Knowledge
Determine  which  sub-stage that the  deal  is currently  in for the  following cases.,Application
Briefly provide any TWO (2) real life situations to illustrate on ethical dilemma.,Comprehension
What are the parts or features of...?,Analysis
Analyse the behavior of subsoil of coarse grained non-cohesive soils and fine grained cohesive soils. ,Analysis
Define transgenic crops.,Knowledge
You are working with SP Setia Properties as the Sales Manager for the following project. Discuss EIGHT (8) ways to increase profits of the project. ,Comprehension
Judge aesthetic qualities and relationship to future values.,Evaluation
"KOMUGI offers a deliciously authentic variety of handmade Japanese breads, cakes and confectioneries. In 23th December 2017, KOMUGI will launch its first outlets in Perak which will be located in Jusco Kinta City, Ipoh. Your client KOMUGI would like to run a coupon promotion for perakian. Design a creative coupon with catchy messages, slogans and offers to attract the perakian. ",Synthesis
"Implement working codes for presentation, business and data layers.",Application
Use dynamic programming to make these allocations to maximize the total grade points to be obtained from the four courses.,Application
Determine the author’s point of view,Comprehension
Calculate the balance of trade when the economy is at equilibrium and interpret the answer. ,Application
Show how NLP techniques can be deployed in business.,Application
List out any SIX (6) factors to be considered when designing a layout. ,Knowledge
"Comment on the values that were generated for “Identities” and “Positives"". ",Evaluation
The Political-Legal Environment of the Home Country is included In International marketing and advertising. Explain the Trade Sanctions and Export and Import Controls. ,Comprehension
Draw the energy band diagram of the pn junction. ,Comprehension
Explain the marginal cost relationship with average variable cost (AVC) and average total cost (ATC). Support your answer by using an appropriate diagram. ,Comprehension
Describe Renaissance art style. ,Knowledge
"As a manager in an Information Technology firm, suggest and elaborate any THREE (3) actions that organizations can take as part of the responsibility towards the society.",Synthesis
Compute the area of actual circles.,Application
Elaborate FOUR (4) advantages of using Web 2.0 and 3.0 in teaching and learning. ,Comprehension
"With reference  to the case, evaluate the similarities  and differences  between  open mindedness and mental models.",Evaluation
Recall basic math facts,Knowledge
"Assuming the elitism selection method where the best chromosomes are selected for pairing, apply the crossover and mutation for the selected pair of chromosomes using the encoding scheme proposed in (b)(i).",Application
Apply the run length encoding on the token stream.,Application
Calculate the length of the projection of vector x on vector y. ,Application
What is a global variable?,Knowledge
Suggest FOUR (4) strategies that improve individuals' psychological well-being from the physiological psychology perspectives. Elaborate your answers with examples. ,Synthesis
"In your opinion, which parental group selected will give a higher gain in Kaseem's breeding programme. Show the calculation and justify your answer. ",Evaluation
Subsurface exploration can be divided into THREE (3) programs. Explain in detail the conclusion that could be derived from each program.,Comprehension
Give FOUR information that can be obtained from Scanning Electron Miscroscope (SEM).,Comprehension
Compare and contrast animals that the class has made.,Analysis
Provide some justifications for the data warehouse architecture that you have chosen in Q2 (a).,Evaluation
Write an essay in not more than 250 words about India and Technological Advancement. Use active voice as much as possible.,Synthesis
How could we determine the number of pennies in a jar without counting them?,Synthesis
How do we efficiently combine multiple subject graphs to construct an aig with choice,Synthesis
Develop a menu for a new healthy foods restaurant,Synthesis
Describe the THREE (3) elements of problem structure of a company. Contrast a structured problem to an unstructured problem. Discuss briefly which levels of management typically deal with structured problems and with unstructured problems. ,Analysis
Retell the story in your words.,Comprehension
Describe FIVE (5) techniques to achieve dominance. ,Knowledge
Distinguish between objectives and learning outcomes when planning a lesson. ,Analysis
Compare three celebrations using a Venn diagram.,Analysis
Explain and differentiate between TWO types of aggregations when colloidal particles are unstable. ,Analysis
Inspect the pattern of GPS positions relative to the “known” published value,Analysis
List the advantages and disadvantages of Public Offering.,Knowledge
What would result if …,Application
Identify any TWO (2) product design strategies you have learned. Explain how both strategies could be useful for instant respond to customer demand. ,Comprehension
"State TWO examples for inorganic and organic contaminants, respectively. ",Knowledge
State the five assumptions of an ideal diode. ,Knowledge
Choose a character. Rewrite a scene from the story from this character's point of view.,Synthesis
Critically review how a shift in the mental model with a different set of assumptions could change Yahoo.,Evaluation
Translate an equation into a computer spreadsheet.,Comprehension
Describe the limitations of using ribozyme as a catalyst. ,Comprehension
Explain the use of scaffolding in construction. ,Comprehension
Define instructional materials and provide an example of it. ,Comprehension
Determine the intrinsic value of KMK Corporation's common stock. ,Application
How many states are there in USA,Knowledge
"Referring to the given poster design, explain in details the usage of elements and principles of arts. ",Comprehension
Suggest a procedure which uses k-means as a subroutine with a better chance than k-means in obtaining good clustering.,Synthesis
What would happen if . . .?,Synthesis
Suggest any THREE (3) scenarios where users  may benefit from using video calls in their communication.,Synthesis
Describe THREE factors that affect soil aeration. ,Comprehension
Audit committee is responsible to implement and support the monitoring function of the board of directors. Develop a list of best practices for audit committee meeting. ,Synthesis
Briefly explain FOUR (4) advantages and disadvantages of option trading. ,Comprehension
Oxidation is one of the most important thermal processes. Briefly explain the TWO (2) types of oxidation process. ,Comprehension
Write 5 new titles for the story that would give a good idea of what it was about,Synthesis
Define briefly the role of marketing in advertising effectiveness. ,Knowledge
"Critically appraise the five competitive forces encased within Porter's ""FIVE FORCES"" model within the context of a profit-oriented organization and discuss the threat posed to the firm by each of these forces.",Evaluation
"Given the data we've looked at on this topic, evaluate how appropriate this conclusion is and defend your answer.",Evaluation
Translate a written text aloud from L2 to English.,Comprehension
Provide three (3) situations whereby it will be useful to use reference variables as parameters.,Knowledge
List another TWO isotherms besides Langmiur isoterm. ,Knowledge
Assess THREE (3) brain structures that are associated with the language / speech function. Elaborate your answers with example. ,Evaluation
Explain about interactive multimedia.,Comprehension
Evaluate THREE (3) neurocognitive difficulties that may be experienced by people with suicidal-related behaviors. ,Evaluation
How could we develop a coherent measure of success for organisations engaged in this type of activity with young people?,Synthesis
Explain how transactions are audited in an electronic data interchange environment. ,Comprehension
"MVC (Model View Controller) leads to low coupling"". Justify.",Evaluation
What happens if you change the direction of the displacement (but not its size)?,Application
Suggest THREE (3) steps that Annie should do in multimedia authoring.,Synthesis
Explain how SWOT and Porter's techniques is applied in the manufacturing industries.,Application
"Optimization of medium and culture conditions of a fermentation process can be conducted by using multifactor experimental design or response surface optimization. With aid of a flow chart, compare and contrast these two methods.",Analysis
"Media planners want both effective and efficient media buys. In your role as a new media planner of a digital marketing agency, explain how would you know you have made an effective advertising buy over the internet. ",Comprehension
Create several scientific hypotheses to …,Synthesis
Describe color wheel. ,Knowledge
Briefly analyse the SIX (6) internal control procedures over the payroll process of a multinational organisation. ,Analysis
Define privacy.,Knowledge
Discuss  any THREE  (3) negative  impacts  of entertainment  media to our society.,Comprehension
How many loop statement available in c++?,Knowledge
Identify FOUR (4) factors that affect the willingness of people to perform prosocial behaviors. ,Comprehension
"John Watson passed away and left behind a legal child, Mary Watson, as well as two girlfriends, Susan and Petty, who were in their 8 week of gestation. Susan claimed that she bore an illegitimate child of John Watson. Propose and design the most suitable paternity experiment to prove Susan's claim. You may outline your experiment using schematic diagram(s). ",Synthesis
Decide whether you learned enough about electricity from this book.,Evaluation
Define and explain reinvestment risk with an example. ,Comprehension
Identify the key points in the text ,Comprehension
Can you group by characteristics such as . . .?,Application
Suggest and justify ONE (1) strategy that your company may consider for marketing its products internationally. ,Evaluation
State your recommended solution with justification.,Evaluation
Discuss FIVE (5) stages of crisis management. Provide your discussion with ONE (1) appropriate example for each stage. ,Comprehension
Compose your own note-taking design that incorporates all theadvantages of the Cornell Method.,Synthesis
Prepare a time-phased product structure. ,Application
Explain the development process for a building construction.,Comprehension
Outline in your own words how the Leggo's Tomato Paste advertisement sells their product.,Comprehension
Identify THREE (3) types of mortar used in wall construction. ,Comprehension
Draw Production Possibilities Frontier and Trading Possibilities Frontier for China and South Africa.,Comprehension
Compare and contrast our school to other communities.,Analysis
"As a spokesperson that is handling the crisis, identify TWO (2) potential trick questions that might be asked by the reporters during the press conference. Provide your answer with explanation and an example for each trick question identified. ",Comprehension
The independence of external auditors is extremely critical due to their roles in providing true and fair view on a company financial position. Develop THREE (3) safeguards to reduce the threats on external auditors' independence. ,Synthesis
Nomination committee plays a crucial role in ensuring the continuity of the board of directors into the future. Analyse the functions of nomination committee in the context of corporate governance. ,Analysis
Discuss in details what Accounting Information Systems (AIS) is. ,Comprehension
Specify TWO (2) limitations of k-means clustering.,Knowledge
Write in details FIVE (5) phases of design process.,Comprehension
Describe dynamic load balancing using centralised work pool approach.,Comprehension
"You are on a mission to study the microbial diversity in a hyperarid desert. Design experimental steps in collecting, storing, and analyzing the samples. Justify the choices in each step and predict the types of microbes that could be found. ",Evaluation
Describe the term 'urbanization' and discuss how urbanization influences the development of marketing and advertising strategies.,Comprehension
Justify the concept of inheritance and give the sample of code to illustrate your answer.,Evaluation
