text,label
"Based on your knowledge on the physics of semiconductors, evaluate the limit for the minimum feature size of silicon MOSFET.",Evaluation
Evaluate if the contact is ohmic or rectifying (Schottky diode) in nature. Provide the analysis and support your answer with calculation,Evaluation
Describe the flow of MOET procedures in cattle breeding. ,Comprehension
Design or sketch a marketing strategy for your product using a known strategy as a model.,Application
"Explain the trading behavior of hedger, speculator and arbitrageur.",Comprehension
Interpret FIVE (5) emerging trends of technology application in education. ,Comprehension
List two reference parameters in the setHour function,Knowledge
Support your answers with ONE (1) example in everyday life for each theory. ,Evaluation
Describe the advantages of Product Standardization. ,Knowledge
"Differentiate among “external wall', 'internal wall' and 'parapet'. ",Analysis
Discuss the usefulness of HttpSessionActivationListener in web applications.,Comprehension
Describe THREE (3) deposit liabilities for commercial banks. ,Knowledge
Name FOUR enzymes in DNA replication and state their functions. ,Comprehension
Compare the electrical conductivity of an insulator and a semiconductor at room temperature by using the energy band diagram. ,Comprehension
Define the term 'Production Possibility Curve' as used in the timber and steel factory. ,Knowledge
which part of a data packet is used by a router to determine the destination network,Knowledge
Express the following systems in matrix form,Comprehension
Shareholder activism is an important governance mechanism because this is how minority shareholders exercise and enforce their rights. Comment on the effectiveness of shareholder activism. ,Evaluation
"By drawing appropriate diagrams, differentiate between flat file model and database model. ",Analysis
Design a machine to perform a specific task.,Synthesis
Name FIVE vital plant processes that herbicides target. ,Knowledge
Enzymes are applied in the medical field based on their specific functions. List the THREE main areas of clinical enzymology and provide ONE example how enzymes are used in each area. ,Comprehension
Draw a picture of the gown Cinderella wore to the ball.,Application
How do you combine the results of various individual tests to determine whether a student can progress to a next semester / phase / year?,Synthesis
Discuss the biological factors that cause the deterioration of cut flowers.,Comprehension
Suggest a way to deal with this scenario,Application
"Classify the following protocols: IP, TCP, HTTP according to the ISO OSI classification",Comprehension
Personalization is becoming an important element in Electronic Commerce. Explain TWO (2) techniques that can be used to learn about consumer behavior and how it can be used to facilitate customer service.,Comprehension
Describe what took place as the Hato was sinking.,Comprehension
"Justify the following statement. ""It is possible for a firm to experience diminishing marginal return and diseconomies of scale at the same time”. ",Evaluation
Explain how Referral Networks approach can be used as a tool to increase number of customers.,Application
Use dynamic programming to help the fortune seeker to identify the route which minimizes the total cost of the policy.,Application
Can you analyze the fractures and determine which should be repaired surgically,Analysis
Analyze a distinction. State the point of view of . . .,Analysis
Identify any TWO (2) advantages of matching demand strategy and level strategy each in preparing aggregate production plan. ,Knowledge
Discuss the differences between a stick diagram and an actual layout. ,Comprehension
"Recite the poem ""Auto Wreck"".",Knowledge
Determine the equilibrium price and quantity.,Application
Draw Production Possibilities Frontier and Trading Possibilities Frontier for China and Thailand. Clearly label the total output before specialization and total output after trade in the diagrams.,Comprehension
Define Classical approach and Human Relations approach. ,Knowledge
Investigate innovations that can enhance future Olympics.,Analysis
Draw the energy band diagram of an intrinsic Si and label the band gap energy. ,Comprehension
"Explain how the Utilize technology, media and materials stage in ASSURE model can help creating a more effective teaching and learning environment. ",Comprehension
How might lifestyles in the United States be modified if a more socialistic system were adopted?,Application
Briefly  explain  any  TWO  (2) observations  of information  technology trend using Moore's Law.,Comprehension
Discuss the advantages of real-time data input and over batch processing in expenditure cycle. ,Comprehension
Develop a set of criteria for distinguishing between a good and bad example of this.,Analysis
Explain how the future of social media can be explained by Web 3.0.  ,Comprehension
"Explain what the author means by the statement ""our intellectual powers are geared to master static relations.",Comprehension
Argue the case for conducting experimental research involving humans and propose guidelines to ensure that the dignity and welfare of the subjects are maintained.,Evaluation
PEST and SWOT are popular strategy tools. Discuss how the TWO(2) tools can be applied in manufacturing business environment.,Application
Explain the FOUR (4) roles of media during a crisis. Support your explanation with an appropriate example for each role. ,Comprehension
Explain the differences between ethical dilemma and ethical lapse.,Comprehension
Discuss FIVE (5) factors that are most likely to influence the effectiveness of upward communication. ,Comprehension
Draw the water surface profile when the rainfall intensity is more than the design rainfall so that the inlet of the cuivert is submerged. Explain how the flow rate can be computed in this case. ,Application
"Using the basic principles of socialism discussed in this course, evaluate the US economic system by providing key arguments to support your judgment.",Evaluation
State the importance of data generated from a given hydrophobicity plot. Describe the relevant information that can be deduced from the plot generated. ,Comprehension
"Propose a fertilizer placement method of nitrogen, phosphorus and potassium for a successful fertilization of a large mango tree. Justify your answer. ",Synthesis
Classify a person who scored 12 and 10 for acceptability  and confidence assuming equal cost of misclassification and current percentage of supporters being 40.,Comprehension
"There are three common types of brick in Malaysia, namely common brick, facing brick and engineering brick. Differentiate the properties and the applications among them. ",Analysis
"Just-in-time (JIT) attempts to remove delays, which do not add value. Explain how JIT copes with weather and its impact on crop harvest and transportation times. ",Comprehension
Explain FOUR (4) factors in the Globalization of Financial Markets. ,Comprehension
Compare and contrast between low context cultures and high context cultures. ,Analysis
Describe the main disadvantage of palm oil with an indigenous broad melting interval ranging from -20 to 50°C. Refined palm oil is further processed to improve its marketable value. Discuss this process in relation to the secondary products from refined palm oil. ,Comprehension
Argue critically with relevant examples.,Evaluation
Explain briefly 'designer' and 'professional designer'.,Comprehension
"Using Tom Duncan's levels of brand relationship intensity, explain the relationship between Apple iPhone and its customers.",Comprehension
"In your own words, describe Supply Chain Management (SCM).",Comprehension
"Critically appraise the five competitive forces encased within Porter's ""Five Forces"" model within the context of a profit-oriented organisation and discuss the threat posed to the firm by each of these forces.",Evaluation
Explain TWO (2) defects which are usually occur on the surface of finished concrete.,Comprehension
"You attempt to purify a single protein X from a complex mixture of proteins. Protein X has a large number of aspartic and glutamic acid residues and no lysine, arginine or histidine residues. Propose an adsorption column chromatography technique which could retain protein X but elute other contaminants at pH 7. State your assumption(s). ",Synthesis
Analyze and discuss the challenges and opportunities that social media creates.,Analysis
"Search engines are key means of attracting traffic to websites. As a new marketing executive with Munchy's Malaysia, recommend THREE (3) tactics used in search engine marketing (SEM). ",Synthesis
Solve the following optimization problem by using the golden section search method and terminate the computation when the length of the interval.  ,Application
Identify THREE (3) classification system of economy. ,Knowledge
Briefly discuss THREE factors with ONE example each that should be considered when determining fertilizer placement method. ,Comprehension
How does public health reporting differ today from reporting two years before,Analysis
Explain the criteria to be a substantial shareholder in Malaysia. Illustrate what and when a substantial shareholder of a listed company need to comply when he/she holds the directorship in it. ,Evaluation
Predict what happens to X if Y increases.,Application
Discuss various practices to achieve maximum yield and production of crude palm oil. ,Comprehension
Discuss in detail the THREE (3) major asset allocation strategies in managing portfolio. ,Comprehension
Pre-cast concrete retaining walls may be constructed with any or all of the joints. Describe the THREE (3) types of joints used. ,Comprehension
Define knowledge and provide an example of knowledge produced by a vehicle management system.,Knowledge
How does autonomy differ with age,Analysis
Justify whether the dam and sire are inbred or outbred. ,Evaluation
Calculate Jensen's measure (Jensen's alpha). Use it to assess the performance of the AOV's Portfolio during the year just ended. ,Application
Identify the standard peripheral components of a computer.,Knowledge
Discuss FIVE (5) advantages of IBS compared to conventional in situ concrete. ,Comprehension
"State any TWO (2) of Malaysia's rules, regulations or standards which are related to scaffolding and falsework. ",Comprehension
Recall the definition of the formula datatype from your assignment 2.,Knowledge
Illustrate Blake and Mouton's Managerial Grid leadership styles using a diagram. Explain each of the management style identified. ,Comprehension
Calculate the equilibrium level of output for four sectors economy with taxes. ,Application
Define Method in JAVA.,Knowledge
Support your answers with TWO (2) examples in everyday life for each strategy. ,Evaluation
Explain the psychological factors which influence consumer behavior. ,Comprehension
Give ONE common crossbreed for porker production in Malaysia and name the state in Peninsular Malaysia that has the highest production rate. ,Comprehension
Suggest and elaborate any TWO (2) efforts or methods that your company may use in order to gain competitive advantage over your competitors.,Synthesis
Make up a new language code and write material using it.,Synthesis
Define instructional materials. Provide an example of an instructional material for a subject. ,Comprehension
State how to find a word in a dictionary,Knowledge
when did saudi arabia start using internet,Knowledge
You have been assigned by your employer to manage their Instagram and Facebook business page. Suggest FIVE (5) ways to increase engagement with your social media users. ,Synthesis
Explain and differentiate between TWO types of aggregations when colloidal particles are unstable.,Analysis
Critically discuss how demographic characteristics would affect a product development in a foreign market.,Analysis
Describe an experiment to answer the question of the effects of weight on the fall of an object.,Application
How can you differentiate between...?,Analysis
Construct an analog circuit with the following specifications,Application
When did the second world war happen ,Knowledge
You are appointed to identify building defects for a new building. Briefly identify SIX (6) common construction problems you would expect for modern buildings. ,Comprehension
The Glass-Steagall Act of 1933 (Banking Act) restricted the asset powers of commercial banks in US to low-risk underwriting areas. List FOUR (4) requirements under Glass-Steagall Act of 1933.,Knowledge
Highlight  THREE  (3) differences  between  bitmap  images  and  vector  graphics.,Comprehension
Interpret FIVE (5) usage of Learning Management System as an emerging technology in the context of teaching and learning.,Comprehension
"Advise the five steps, as recommended by Porter and Millar, that can be applied by business managers in taking advantage of information technology.",Synthesis
List down the environmental factors that an international marketer should consider. ,Knowledge
Suggest THREE (3) methods Game2 can take to prevent damage to its Web sites and continuing operations.  Justify your answer.,Evaluation
Draw a table indicating purification fold and yield at each step. ,Comprehension
Construct the 4-Bit Ripple carry Adder Circuit,Application
Discuss the factors that affect the stability of high-rise buildings.,Comprehension
Define the term Radio Frequency Identification (RFID).,Knowledge
Judge whether it would be possible to survive on an island alone and blinded. Write about it.,Evaluation
Design a new animal to live in the jungle.,Synthesis
"The tyrosinase-containing solution was dissolved in 50 mM potassium phosphate buffer containing 0.01 mM NaCl, pH 6.5, before applying to a DEAE Sephadex A50 column. Suggest and explain how the mobile phase should be modified to elute the bound tyrosinase. ",Synthesis
Provide FIVE (5) examples on how HP can use text mining in other areas.,Application
Propose a strategy that minority can use to influence the majority. Support your answer with ONE (1) relevant example. Elaborate your example in details. ,Synthesis
How did Chinese newspapers differ from US,Analysis
Differentiate between qualitative research and quantitative research in terms of their goal and design.,Analysis
Discuss the potential profit and loss for the long straddle. ,Comprehension
What are major facts about particular cultures and societies,Knowledge
Compare this piece of music with the music recorded in CD quality. ,Comprehension
"Using an appropriate example, explain how static data can be shared effectively among several web resources.",Comprehension
Describe what hydraulic engineering is in your own words showing concrete examples. ,Comprehension
List down ALL types of brick wall and give explanations for each type of the wall. ,Comprehension
Do you think . . . is a good or a bad thing?,Evaluation
Describe  the  differences  between  HTTP  session  listeners  and  servlet  request listeners.,Comprehension
Provide TWO  (2) possible reasons why AirAsia  decide to offer this new online service.,Comprehension
Suggest a house-style and editorial policies for your newly introduced newspaper targeted at young readers aged between 15 to 25 years.,Synthesis
Calculate the carrier densities of the doped semiconductor at 400 K. ,Application
List four traits commonly used for the development of transgenic crops.,Knowledge
Would you have liked to have had Cinderella for a sister? Explain why or why not.,Evaluation
The major constituent of palm oil is triglyceride. Describe TWO reactions of triglyceride which could affect the quality of vegetable oils.,Comprehension
Evaluate the benefits and drawbacks of artificial drainage. ,Evaluation
Explain choices made in making recommendations to an end user.,Evaluation
State the purposes of risk assessment. ,Knowledge
Design and sketch the layout of a CMOS inverter. ,Synthesis
Determine the Macaulay duration and estimate the bond price if the yield increases by 100 basis points. ,Application
Conduct an investigation to produce information to support a view.,Analysis
Describe what multimedia is.,Knowledge
Explain the importance of using initial velocity to study enzymatic catalysis. ,Comprehension
Discuss FOUR (4) key components that involve in explaining an organizational crisis. Explain your answer with an example for each component. ,Comprehension
Compare and contrast between low context cultures and high context cultures. ,Analysis
Recommend to the management whether to use MP3 or RealAudio file format images and state THREE (3) reasons for your recommendations. ,Synthesis
when was the first airport in the yemen built,Knowledge
Identify the type of crisis based on time as a critical variable. ,Comprehension
Explain each inventory control method and suggest TWO (2) types of products for each method.,Synthesis
Explain the conceptual design process. ,Comprehension
Evaluate two Internet sources of information about the Egyptians. Which would be a better choice for your purpose and why?,Evaluation
Tell in your own words the beginning of the book.,Comprehension
Distinguish between products from physical and chemical weathering. ,Analysis
Explain what is meant by the term Interactivity.,Comprehension
How many years does this animal live?,Knowledge
Describe how Phillip and Timothy survived on the Cay.,Comprehension
"Differentiate the passages that attacked a political opponent personally, and those that attacked an opponent's political programs.",Analysis
"For any points which fall exactly on the curve, explain the combination of production for steel and bricks. ",Comprehension
Explain each inventory control method and suggest TWO (2) types of products for each method.,Synthesis
Describe the term 'urbanization' and discuss how urbanization influences the development of marketing and advertising strategies.,Comprehension
Develop an ABC classification system for the 10 items. ,Synthesis
Describe FIVE (5) categories of space.,Knowledge
Use the distance travelled and cost of petrol to calculate the cost of a coach trip using a spreadsheet.,Application
How would you express ________________?,Comprehension
Winer (2001) proposes a 7-component Customer Relationship Management (CRM) Model as a framework to implement a successful CRM program. Evaluate each of the seven components of the CRM Model.,Evaluation
"Referring to the advertisement design below, evaluate the usage of Dominance and Unity in principles of design.",Evaluation
"In a table, list EIGHT differences between GenBank and RefSeq DNA sequences. ",Comprehension
Define the basic concepts involved in incorporating technology in teaching English language at secondary school level. ,Comprehension
Reason why hunger cannot be simplified as yet another homeostatic process. Provide TWO (2) points. ,Comprehension
 How are the adolescents with ASD similar of different from each other in their sources of communication breakdowns ?,Analysis
Paraphrase the poem in your own words,Comprehension
Explain the FIVE (5) stages of organizational conflict according to Pondy's (1967) model. ,Comprehension
How would you justify . . . ?,Evaluation
Apply the Karush-Kuhn-Tucker conditions for this problem to derive an optimal solution.,Application
Explain how Referral Networks approach can be used as a tool to increase number of customers.,Application
Use a sketch too find the exact value of each expression,Application
Determine which Angus bull would produce the heaviest offspring (on average). Justify your answer. ,Evaluation
"Explain the term conjugal families, by making reference to the different types of societies to which they could belong.",Analysis
"Using the multiplier approach, suppose government increases spending to 2200 and decreases tax by 500, calculate the new equilibrium output level and the new balance of trade.",Application
"By using an appropriate diagram, explain how the open market operation (OMO) can put an upward pressure on the federal fund rate (FFR).",Comprehension
Discuss the advantages of dynamic logic circuit compared to the conventional static combinational logic circuit. ,Comprehension
Write a program that uses nested loops to print the following output:,Synthesis
About what proportion of the population of the US is living on farms?,Knowledge
Name the property that states that,Knowledge
"Given two possible solutions, A and B, to solving the given software development problem, decide on the best solution. Give your justification.",Evaluation
Illustrate SIX processes that occur in the hydrological cycle. ,Comprehension
Discuss the importance of knowing herbicide families and mode of action. ,Comprehension
Translate an equation into a spreadsheet formula.,Comprehension
Briefly discuss why the emergence of the data warehouse phenomenon is causing such interest in the business world.,Comprehension
Name one character. Rewrite the story from this character's point of view.,Synthesis
Use the Chapman-Kolmogorov Equations procedure to find the n-step transition matrix pUi for n = 2 and 5.,Application
Define Chiaroscuro and Sfumato technique.,Knowledge
Argue critically with relevant examples.,Evaluation
Discuss the importance of soil structure in vegetable farms. ,Comprehension
Briefly explain why fatty acids such as stearic acid can be used in Langmuir Blodgett (LB) film deposition and how the monolayer is formed.,Comprehension
Cloud computing evolved from earlier technologies. State them.,Knowledge
"Your advice has been sought to settle the following dispute in Company X. Referring to appropriate legal principles, write a short report advising the company on the best course of action to adopt.",Evaluation
Decide which candidate would best fill the position of principal.,Evaluation
Discuss the nature of socialism.,Comprehension
Recall the equation for the Ideal Gas Law.,Knowledge
State THREE advantages of pregnancy diagnosis in animal breeding. ,Knowledge
The general objective of inventory control is to minimize the total cost of keeping the inventory while making trade-offs. Elaborate the FOUR (4) major categories of cost in inventory control. ,Comprehension
Malaysian Code on Corporate Governance (MCCG 2017) encourages Board of Directors to improve shareholders' participations in decision making. Provide recommendations that will lead to more constructive use of Annual General Meeting (AGM). ,Synthesis
Draw a Picture Window layout design. ,Comprehension
Discuss TWO (2) key differences between stock warrants and stock options. ,Comprehension
"In a table form, differentiate between RefSeq and GenBank DNA sequences. ",Analysis
Compare and contrast Address Verification  System (AVS) and Card verification number (CVN).,Analysis
Make a radio announcement that advertise the book. Write it out.,Synthesis
Apply and integrate several different strategies to solve a mathematical problem (not according to one formula(,Synthesis
Discuss any THREE (3) ways by which an organization can benefit from e-commerce.,Comprehension
Critically discuss the quote above and explain FIVE(5) ways the interest groups can be more effective with relevant examples.,Analysis
Discuss the factors that you think may have affected the quality of newspapers in Malaysia and identify the key elements for a successful newspaper .,Analysis
Distinguish between chemically defined media and natural media.,Analysis
Briefly explain the differences between and Langmuir-Blodgett (LB) monolayer and self-assembled monolayer (SAM). ,Comprehension
Predict the challenge to implement an augmented  reality  application  in  UTAR campus.,Application
Evaluate the need for ethics in research.,Evaluation
Can you defend your position about . . .?,Evaluation
Explain how the heart is like a pump.,Comprehension
State in your own words where in the library to find previous issues of journals that are no longer in the display racks.,Comprehension
Distinguish between ‘land surveyor' and 'quantity surveyor'.,Analysis
Identify FIVE (5) points on how social media can be utilized by the organization during a crisis. Elaborate your answers with explanation for each point. ,Comprehension
"Assume that an economy is initially below the natural rate of output, due to the stock market crash in 2008. Explain what policy the government can implement in order to return the output to the natural level by using appropriate diagram.",Comprehension
"Name the amino acid residues with the single letter code ""EQRNHL"". ",Knowledge
Distinguish clearly between power and authority.,Analysis
Explain and justify a new budget.,Evaluation
Discuss the role of hydraulic engineering in the sustainable development and preservation. ,Comprehension
"Using an appropriate example, describe how competitive ELISA works. ",Comprehension
Explain briefly the design development process.,Comprehension
State the conditions necessary for the formation of enzyme's quaternary structure. Explain how quaternary structure could contribute to enzyme stability. ,Comprehension
"Using appropriate examples, differentiate between agglomerative  and divisive in the context of agglomerative hierarchical clustering.",Analysis
"Discuss critically, by using your understanding of nature and nurture.",Evaluation
"Microbiota-based models may be an alternative method to facilitate the use of data on the gut microbiota in certain diseases. For example, NextSeq 550 and NextSeq 550DX platforms have been used to detect gut microbiota in non communicable diseases. Compare and contrast both platforms with regards to their regulatory status, key applications and array scanning.",Analysis
Classify information systems based on the support IS can provide.,Comprehension
